{
  "genres": [
    {
      "name": "Stoner Rock",
      "slug": "stoner-rock"
    },
    {
      "name": "Desert Rock",
      "slug": "desert-rock"
    },
    {
      "name": "Doom Metal",
      "slug": "doom-metal"
    },
    {
      "name": "Alternative Rock",
      "slug": "alternative-rock"
    },
    {
      "name": "Indie Pop",
      "slug": "indie-pop"
    },
    {
      "name": "Russian Pop",
      "slug": "russian-pop"
    },
    {
      "name": "Phonk",
      "slug": "phonk"
    },
    {
      "name": "Drift Phonk",
      "slug": "drift-phonk"
    },
    {
      "name": "Russian Punk Rock",
      "slug": "russian-punk-rock"
    }
  ],
  "merch_kinds": [
    {
      "name": "Cassette",
      "slug": "cassette"
    },
    {
      "name": "Cap",
      "slug": "cap"
    },
    {
      "name": "CD",
      "slug": "cd"
    },
    {
      "name": "T-Shirt",
      "slug": "tshirt"
    },
    {
      "name": "Vinyl",
      "slug": "vinyl"
    }
  ],
  "merch_templates": [
    {
      "name": "{artist} Logo T-Shirt",
      "kind_slug": "tshirt",
      "price": "1490.00",
      "description": "Fixture футболка артиста {artist}.",
      "property_name": "Размер",
      "variants": [
        {
          "value": "S",
          "stock": 8
        },
        {
          "value": "M",
          "stock": 12
        },
        {
          "value": "L",
          "stock": 10
        },
        {
          "value": "XL",
          "stock": 6
        }
      ]
    },
    {
      "name": "{artist} Logo Cap",
      "kind_slug": "cap",
      "price": "1190.00",
      "description": "Fixture кепка артиста {artist}.",
      "stock": 14
    },
    {
      "name": "{artist} First Album CD",
      "kind_slug": "cd",
      "price": "990.00",
      "description": "Fixture CD первого альбома артиста {artist}.",
      "album_index": 1,
      "property_name": "Издание",
      "variants": [
        {
          "value": "Jewel Case",
          "stock": 12
        },
        {
          "value": "Digipak",
          "stock": 7
        }
      ]
    },
    {
      "name": "{artist} First Album Cassette",
      "kind_slug": "cassette",
      "price": "790.00",
      "description": "Fixture кассета первого альбома артиста {artist}.",
      "album_index": 1,
      "stock": 8
    },
    {
      "name": "{artist} First Album Vinyl",
      "kind_slug": "vinyl",
      "price": "2490.00",
      "description": "Fixture винил первого альбома артиста {artist}.",
      "album_index": 1,
      "property_name": "Формат",
      "variants": [
        {
          "value": "Black LP",
          "stock": 7
        },
        {
          "value": "Color LP",
          "stock": 4
        }
      ]
    }
  ],
  "artists": [
    {
      "name": "Kyuss",
      "slug": "kyuss",
      "city": "Palm Desert",
      "genre_slug": "stoner-rock",
      "albums": [
        {
          "name": "Blues for the Red Sun",
          "release_date": "1992-06-30",
          "genre_slug": "desert-rock",
          "tracks": [
            "Thumb",
            "Green Machine",
            "Molten Universe"
          ]
        },
        {
          "name": "Welcome to Sky Valley",
          "release_date": "1994-06-28",
          "genre_slug": "stoner-rock",
          "tracks": [
            "Gardenia",
            "Asteroid",
            "Whitewater"
          ]
        }
      ]
    },
    {
      "name": "Queens of the Stone Age",
      "slug": "queens-of-the-stone-age",
      "city": "Palm Desert",
      "genre_slug": "alternative-rock",
      "albums": [
        {
          "name": "Rated R",
          "release_date": "2000-06-06",
          "genre_slug": "alternative-rock",
          "tracks": [
            "Feel Good Hit of the Summer",
            "The Lost Art of Keeping a Secret",
            "In the Fade"
          ]
        },
        {
          "name": "Songs for the Deaf",
          "release_date": "2002-08-27",
          "genre_slug": "desert-rock",
          "tracks": [
            "No One Knows",
            "Go with the Flow",
            "Song for the Dead"
          ]
        }
      ]
    },
    {
      "name": "Sleep",
      "slug": "sleep",
      "city": "San Jose",
      "genre_slug": "doom-metal",
      "albums": [
        {
          "name": "Holy Mountain",
          "release_date": "1992-11-03",
          "genre_slug": "doom-metal",
          "tracks": [
            "Dragonaut",
            "The Druid",
            "Holy Mountain"
          ]
        },
        {
          "name": "The Sciences",
          "release_date": "2018-04-20",
          "genre_slug": "stoner-rock",
          "tracks": [
            "The Sciences",
            "Marijuanaut's Theme",
            "Sonic Titan"
          ]
        }
      ]
    },
    {
      "name": "Fu Manchu",
      "slug": "fu-manchu",
      "city": "San Clemente",
      "genre_slug": "stoner-rock",
      "albums": [
        {
          "name": "In Search Of...",
          "release_date": "1996-10-08",
          "genre_slug": "stoner-rock",
          "tracks": [
            "Regal Begal",
            "The Falcon Has Landed",
            "Cyclone Launch"
          ]
        },
        {
          "name": "The Action Is Go",
          "release_date": "1997-10-07",
          "genre_slug": "stoner-rock",
          "tracks": [
            "Evil Eye",
            "Urethane",
            "Shift Kicker"
          ]
        }
      ]
    },
    {
      "name": "Red Fang",
      "slug": "red-fang",
      "city": "Portland",
      "genre_slug": "stoner-rock",
      "albums": [
        {
          "name": "Murder the Mountains",
          "release_date": "2011-04-12",
          "genre_slug": "stoner-rock",
          "tracks": [
            "Wires",
            "Hank Is Dead",
            "Throw Up"
          ]
        },
        {
          "name": "Only Ghosts",
          "release_date": "2016-10-14",
          "genre_slug": "alternative-rock",
          "tracks": [
            "Cut It Short",
            "Shadows",
            "Flies"
          ]
        }
      ]
    },
    {
      "name": "Truckfighters",
      "slug": "truckfighters",
      "city": "Orebro",
      "genre_slug": "stoner-rock",
      "albums": [
        {
          "name": "Gravity X",
          "release_date": "2005-08-01",
          "genre_slug": "stoner-rock",
          "tracks": [
            "Desert Cruiser",
            "Gargarismo",
            "Superfunk"
          ]
        },
        {
          "name": "Mania",
          "release_date": "2009-09-30",
          "genre_slug": "desert-rock",
          "tracks": [
            "Last Curfew",
            "Monte Gargano",
            "Majestic"
          ]
        }
      ]
    },
    {
      "name": "Дора",
      "slug": "dora",
      "city": "Moscow",
      "genre_slug": "russian-pop",
      "albums": [
        {
          "name": "Младшая сестра",
          "release_date": "2019-11-08",
          "genre_slug": "russian-pop",
          "tracks": [
            "Втюрилась",
            "Дорадура",
            "Любовь в интернете"
          ]
        },
        {
          "name": "Miss",
          "release_date": "2020-11-20",
          "genre_slug": "indie-pop",
          "tracks": [
            "Сан Ларан",
            "Если хочешь",
            "Ночи"
          ]
        }
      ]
    },
    {
      "name": "DVRST",
      "slug": "dvrst",
      "city": "Moscow",
      "genre_slug": "drift-phonk",
      "albums": [
        {
          "name": "Night Drive",
          "release_date": "2021-07-30",
          "genre_slug": "drift-phonk",
          "tracks": [
            "Close Eyes",
            "Skyline",
            "Midnight Drift"
          ]
        },
        {
          "name": "Street Echoes",
          "release_date": "2022-10-21",
          "genre_slug": "phonk",
          "tracks": [
            "Nightcrawler",
            "Grim Avenue",
            "Turbo Memory"
          ]
        }
      ]
    },
    {
      "name": "Kordhell",
      "slug": "kordhell",
      "city": "Los Angeles",
      "genre_slug": "drift-phonk",
      "albums": [
        {
          "name": "Phantom Drift",
          "release_date": "2021-11-26",
          "genre_slug": "drift-phonk",
          "tracks": [
            "Murder In My Mind",
            "Fatality",
            "Ghostline"
          ]
        },
        {
          "name": "Neon Hell",
          "release_date": "2023-04-14",
          "genre_slug": "phonk",
          "tracks": [
            "Scopin",
            "Bleed",
            "Engine Roar"
          ]
        }
      ]
    },
    {
      "name": "Элизиум",
      "slug": "elysium",
      "city": "Nizhny Novgorod",
      "genre_slug": "russian-punk-rock",
      "albums": [
        {
          "name": "Космос",
          "release_date": "2005-03-10",
          "genre_slug": "russian-punk-rock",
          "tracks": [
            "Острова",
            "Романтика",
            "Космос"
          ]
        },
        {
          "name": "13",
          "release_date": "2013-09-01",
          "genre_slug": "russian-punk-rock",
          "tracks": [
            "Инопланетяне",
            "Точка невозврата",
            "Снег"
          ]
        }
      ]
    },
    {
      "name": "Порнофильмы",
      "slug": "pornofilmy",
      "city": "Dubna",
      "genre_slug": "russian-punk-rock",
      "albums": [
        {
          "name": "Это пройдёт",
          "release_date": "2020-01-24",
          "genre_slug": "russian-punk-rock",
          "tracks": [
            "Россия для грустных",
            "Прости. Прощай. Привет",
            "Это пройдёт"
          ]
        },
        {
          "name": "В диапазоне между отчаянием и надеждой",
          "release_date": "2017-10-01",
          "genre_slug": "russian-punk-rock",
          "tracks": [
            "Ритуалы",
            "Кто все эти люди?",
            "Молодость"
          ]
        }
      ]
    },
    {
      "name": "Тараканы!",